{
  "schema_id": "trader1.market_regime_adaptation_report.v1",
  "generated_at_utc": "2026-04-29T04:50:00Z",
  "project_id": "TRADER_1",
  "authority": {
    "trader1_sha256": "FF6C3046FD64C3B16E874F3770CCB57E04B1E1E75775125382F285F33BD0052B",
    "agents_sha256": "21F059ED68723E632704422C2E4DE94EA4093E49D4C3C5963A821B0C0953941D"
  },
  "adaptation_report_id": "market_regime_adaptation_fixture_pass",
  "exchange": "UPBIT",
  "market_type": "KRW_SPOT",
  "mode": "PAPER",
  "session_id": "mvp4_market_regime_adaptation_fixture",
  "symbol": "KRW-BTC",
  "strategy_id": "mvp4_multi_family_review",
  "strategy_build_id": "strategy_build_mvp4_regime_adaptation",
  "parameter_hash": "AAAAAAAAAAAAAAAAAAAAAAAAAAAAAAAAAAAAAAAAAAAAAAAAAAAAAAAAAAAAAAAA",
  "timeframe_scope": "15m",
  "regime_scope": "TRENDING_RANGE_RISK_OFF",
  "previous_regime_family": "RANGE",
  "current_regime_family": "TRENDING",
  "current_trend_direction": "UPTREND",
  "adaptation_signal": "REGIME_SHIFT",
  "adaptation_status": "ADAPTATION_RECOMMENDED",
  "recommended_action": "ADAPT_REGIME_SCOPE",
  "entry_allowed": true,
  "primary_blocker_code": null,
  "source_modes": ["PAPER", "SHADOW"],
  "source_evidence_ids": [
    "paper_regime_fixture_market_data_fresh",
    "paper_regime_fixture_symbol_fit",
    "paper_regime_fixture_condition_matrix",
    "paper_regime_fixture_strategy_memory"
  ],
  "source_artifact_roles": [
    {"role": "MARKET_DATA_FRESHNESS", "artifact_id": "paper_regime_fixture_market_data_fresh"},
    {"role": "SYMBOL_STRATEGY_REGIME_FIT", "artifact_id": "paper_regime_fixture_symbol_fit"},
    {"role": "STRATEGY_CONDITION_MATRIX", "artifact_id": "paper_regime_fixture_condition_matrix"},
    {"role": "STRATEGY_PERFORMANCE_MEMORY", "artifact_id": "paper_regime_fixture_strategy_memory"},
    {"role": "PAPER_SHADOW_EVIDENCE", "artifact_id": "shadow_regime_fixture_observation"}
  ],
  "data_freshness_status": "FRESH",
  "data_age_seconds": 45,
  "max_data_age_seconds": 120,
  "timeframe_scope_confirmed": true,
  "regime_scope_confirmed": true,
  "symbol_strategy_regime_fit_validator_status": "PASS",
  "strategy_condition_matrix_validator_status": "PASS",
  "strategy_performance_memory_validator_status": "PASS",
  "official_api_verification_status": "NOT_USED",
  "live_observation_used": false,
  "read_only_live_observation_allowed": false,
  "recommended_strategy_families": ["TREND_PULLBACK", "BREAKOUT_RETEST"],
  "blocked_strategy_families": ["VWAP_REVERSION"],
  "operator_warning": "dashboard display truth only; not live_ready and live orders blocked",
  "next_operator_action": "continue paper/shadow review and keep live blocked until external evidence exists",
  "dashboard_display_truth_only": true,
  "execution_truth_created": false,
  "promotion_eligible": false,
  "blocks_live_order": true,
  "live_permission_created": false,
  "live_config_mutation_allowed": false,
  "writes_live_ready_snapshot": false,
  "active_snapshot_mutation_allowed": false,
  "optimizer_winner_live_config_allowed": false,
  "paper_winner_live_config_allowed": false,
  "live_order_ready": false,
  "live_order_allowed": false,
  "can_live_trade": false,
  "scale_up_allowed": false,
  "blockers": [],
  "adaptation_report_hash": "BBBBBBBBBBBBBBBBBBBBBBBBBBBBBBBBBBBBBBBBBBBBBBBBBBBBBBBBBBBBBBBB"
}
